{
  "$schema": "http://json-schema.org/draft-07/schema#",
  "$ref": "#/definitions/GameData",
  "definitions": {
    "GameData": {
      "type": "object",
      "properties": {
        "traps": {
          "type": "object",
          "additionalProperties": {
            "$ref": "#/definitions/Trap"
          }
        },
        "drifts": {
          "type": "object",
          "additionalProperties": {
            "$ref": "#/definitions/Trap"
          }
        },
        "creatures": {
          "type": "object",
          "additionalProperties": {
            "$ref": "#/definitions/Creature"
          }
        },
        "variants": {
          "type": "object",
          "additionalProperties": {
            "$ref": "#/definitions/Variant"
          }
        },
        "templates": {
          "type": "object",
          "additionalProperties": {
            "$ref": "#/definitions/Template"
          }
        },
        "dungeons": {
          "type": "object",
          "additionalProperties": {
            "$ref": "#/definitions/Dungeon"
          }
        },
        "encounter": {
          "$ref": "#/definitions/Encounter"
        }
      },
      "required": [
        "traps",
        "drifts",
        "creatures",
        "variants",
        "templates",
        "dungeons",
        "encounter"
      ],
      "additionalProperties": false
    },
    "Trap": {
      "type": "object",
      "properties": {
        "name": {
          "type": "string"
        },
        "icon": {
          "type": "string"
        },
        "kind": {
          "$ref": "#/definitions/TriggerKind"
        },
        "on": {
          "$ref": "#/definitions/On"
        },
        "when": {
          "$ref": "#/definitions/Condition"
        },
        "every": {
          "type": "number"
        },
        "quiet": {
          "type": "boolean"
        },
        "desc": {
          "type": "string"
        },
        "do": {
          "type": "array",
          "items": {
            "$ref": "#/definitions/Effect"
          }
        }
      },
      "required": [
        "name",
        "on",
        "do"
      ],
      "additionalProperties": false
    },
    "TriggerKind": {
      "type": "string",
      "enum": [
        "trap",
        "trick"
      ],
      "description": "Valence of a reactive trigger: a Trap is hostile (avoid, yellow); a Trick is favorable (aim for, green). Same mechanism (condition → effects); only valence + presentation differ. Default when omitted is 'trap'."
    },
    "On": {
      "type": "string",
      "enum": [
        "match",
        "tick"
      ]
    },
    "Condition": {
      "anyOf": [
        {
          "$ref": "#/definitions/SimpleCondition"
        },
        {
          "$ref": "#/definitions/CompoundCondition"
        }
      ]
    },
    "SimpleCondition": {
      "anyOf": [
        {
          "type": "object",
          "properties": {
            "axis": {
              "type": "string",
              "const": "color"
            },
            "mode": {
              "$ref": "#/definitions/Mode"
            },
            "value": {
              "$ref": "#/definitions/ColorTok"
            }
          },
          "required": [
            "axis",
            "mode"
          ],
          "additionalProperties": false
        },
        {
          "type": "object",
          "properties": {
            "axis": {
              "type": "string",
              "const": "shape"
            },
            "mode": {
              "$ref": "#/definitions/Mode"
            },
            "value": {
              "$ref": "#/definitions/ShapeTok"
            }
          },
          "required": [
            "axis",
            "mode"
          ],
          "additionalProperties": false
        },
        {
          "type": "object",
          "properties": {
            "axis": {
              "type": "string",
              "const": "number"
            },
            "mode": {
              "$ref": "#/definitions/Mode"
            },
            "value": {
              "$ref": "#/definitions/NumberTok"
            }
          },
          "required": [
            "axis",
            "mode"
          ],
          "additionalProperties": false
        }
      ]
    },
    "Mode": {
      "type": "string",
      "enum": [
        "all_same",
        "all_different",
        "contains",
        "not_value"
      ]
    },
    "ColorTok": {
      "type": "string",
      "enum": [
        "red",
        "green",
        "blue"
      ]
    },
    "ShapeTok": {
      "type": "string",
      "enum": [
        "attack",
        "defend",
        "move"
      ]
    },
    "NumberTok": {
      "type": "string",
      "enum": [
        "one",
        "two",
        "three"
      ]
    },
    "CompoundCondition": {
      "type": "object",
      "properties": {
        "all": {
          "type": "array",
          "items": {
            "$ref": "#/definitions/SimpleCondition"
          }
        }
      },
      "required": [
        "all"
      ],
      "additionalProperties": false,
      "description": "Compound AND of simple conditions (e.g. all-Move AND all-1s — the Limbless trigger)."
    },
    "Effect": {
      "type": "object",
      "properties": {
        "effect": {
          "$ref": "#/definitions/EffectName"
        },
        "chance": {
          "type": "number"
        },
        "amount": {
          "type": "number"
        },
        "max": {
          "type": "number"
        },
        "seconds": {
          "type": "number"
        },
        "color": {
          "$ref": "#/definitions/ColorTok"
        },
        "count": {
          "type": "number"
        },
        "select": {
          "$ref": "#/definitions/Selector"
        },
        "bias": {
          "$ref": "#/definitions/Bias"
        },
        "gap": {
          "type": "number"
        },
        "scale": {
          "type": "string",
          "const": "set_mag",
          "description": "severity scaled by the springing set's TOTAL magnitude: max(1, total − 4) — a modest 1+2+3 rainbow pays the mild price, a greedy 3/3/3 pays for its weight (damage / advance_timer)."
        }
      },
      "required": [
        "effect"
      ],
      "additionalProperties": false
    },
    "EffectName": {
      "type": "string",
      "enum": [
        "damage",
        "instant_attack",
        "advance_timer",
        "delay_attack",
        "enemy_heal",
        "drain_tactics",
        "drain_mana",
        "transmute",
        "lock"
      ]
    },
    "Selector": {
      "type": "object",
      "properties": {
        "geometry": {
          "$ref": "#/definitions/Geometry"
        },
        "which": {
          "$ref": "#/definitions/Which"
        },
        "index": {
          "type": "number"
        },
        "center": {
          "type": "number"
        },
        "count": {
          "type": "number"
        },
        "axis": {
          "$ref": "#/definitions/Axis"
        },
        "mode": {
          "$ref": "#/definitions/Mode"
        },
        "value": {
          "$ref": "#/definitions/ValueTok"
        },
        "pick": {
          "type": "string",
          "const": "highest_mag"
        }
      },
      "additionalProperties": false
    },
    "Geometry": {
      "type": "string",
      "enum": [
        "row",
        "column",
        "diagonal",
        "corners",
        "border",
        "center",
        "inner",
        "half",
        "random"
      ]
    },
    "Which": {
      "type": "string",
      "enum": [
        "top",
        "bottom",
        "left",
        "right",
        "center",
        "anti"
      ]
    },
    "Axis": {
      "type": "string",
      "enum": [
        "color",
        "shape",
        "number"
      ]
    },
    "ValueTok": {
      "anyOf": [
        {
          "$ref": "#/definitions/ColorTok"
        },
        {
          "$ref": "#/definitions/ShapeTok"
        },
        {
          "$ref": "#/definitions/NumberTok"
        }
      ]
    },
    "Bias": {
      "anyOf": [
        {
          "type": "object",
          "properties": {
            "axis": {
              "type": "string",
              "const": "color"
            },
            "value": {
              "$ref": "#/definitions/ColorTok"
            },
            "intensity": {
              "type": "number"
            }
          },
          "required": [
            "axis",
            "value"
          ],
          "additionalProperties": false
        },
        {
          "type": "object",
          "properties": {
            "axis": {
              "type": "string",
              "const": "shape"
            },
            "value": {
              "$ref": "#/definitions/ShapeTok"
            },
            "intensity": {
              "type": "number"
            }
          },
          "required": [
            "axis",
            "value"
          ],
          "additionalProperties": false
        },
        {
          "type": "object",
          "properties": {
            "axis": {
              "type": "string",
              "const": "number"
            },
            "value": {
              "$ref": "#/definitions/NumberTok"
            },
            "intensity": {
              "type": "number"
            }
          },
          "required": [
            "axis",
            "value"
          ],
          "additionalProperties": false
        }
      ]
    },
    "Creature": {
      "type": "object",
      "properties": {
        "name": {
          "type": "string"
        },
        "tier": {
          "$ref": "#/definitions/Tier"
        },
        "stats": {
          "$ref": "#/definitions/CreatureStats"
        },
        "hp": {
          "type": "number"
        },
        "tempo": {
          "$ref": "#/definitions/TempoOverride"
        },
        "desc": {
          "type": "string"
        },
        "voice": {
          "$ref": "#/definitions/Voice"
        },
        "traps": {
          "type": "array",
          "items": {
            "type": "string"
          }
        },
        "variants": {
          "type": "array",
          "items": {
            "type": "string"
          }
        },
        "rules": {
          "$ref": "#/definitions/FoeRules"
        },
        "loot_tier": {
          "type": "number"
        },
        "xp": {
          "type": "number"
        }
      },
      "required": [
        "name",
        "tier",
        "stats",
        "hp",
        "loot_tier"
      ],
      "additionalProperties": false
    },
    "Tier": {
      "type": "string",
      "enum": [
        "minion",
        "elite",
        "boss"
      ]
    },
    "CreatureStats": {
      "type": "object",
      "properties": {
        "power": {
          "type": "number"
        },
        "endurance": {
          "type": "number"
        },
        "speed": {
          "type": "number"
        }
      },
      "required": [
        "power",
        "endurance",
        "speed"
      ],
      "additionalProperties": false,
      "description": "A foe's contest statline — the other side of every resolve.ts contest. Authored directly against the parity line `10 + 2(L−1)` (CRAWL §3 / TUNING.md): warren = fresh L3 → ~14, with role spreads (swift −2P/+5S · steady · heavy +2P/−5S · giant +4P/−9S) and per-tier E bumps (elite +4 / boss +8) baked into the numbers — no automatic tier bump at assembly."
    },
    "TempoOverride": {
      "type": "object",
      "properties": {
        "strikeEvery": {
          "type": "number"
        },
        "swings": {
          "type": "number"
        }
      },
      "required": [
        "strikeEvery",
        "swings"
      ],
      "additionalProperties": false,
      "description": "Override the tempo law's S−P packaging (else strikeEvery/swings derive from the statline)."
    },
    "Voice": {
      "type": "object",
      "properties": {
        "hit": {
          "type": "array",
          "items": {
            "type": "string"
          }
        },
        "heal": {
          "type": "array",
          "items": {
            "type": "string"
          }
        },
        "zero": {
          "type": "string"
        }
      },
      "additionalProperties": false,
      "description": "Combat-log voice: swappable verbs so a foe reads in character (the zombie gnaws, the behemoth booms). Pure flavour — the UI's combat log consumes it; absent fields fall back to a neutral default."
    },
    "FoeRules": {
      "type": "object",
      "properties": {
        "immune_card_damage": {
          "type": "boolean"
        },
        "ability_damage": {
          "type": "string",
          "const": "mana_spent"
        }
      },
      "additionalProperties": false
    },
    "Variant": {
      "type": "object",
      "properties": {
        "name": {
          "type": "string"
        },
        "icon": {
          "type": "string"
        },
        "desc": {
          "type": "string"
        },
        "stat_mod": {
          "$ref": "#/definitions/StatMod"
        },
        "trap": {
          "$ref": "#/definitions/InlineTrap"
        }
      },
      "required": [
        "name",
        "trap"
      ],
      "additionalProperties": false
    },
    "StatMod": {
      "type": "object",
      "properties": {
        "power": {
          "type": "number"
        },
        "endurance": {
          "type": "number"
        },
        "speed": {
          "type": "number"
        },
        "hp": {
          "type": "number"
        }
      },
      "additionalProperties": false,
      "description": "Variant/template stat deltas (added to the base statline). Replaced the legacy hp/damage/ speed_band mods in the data rebase."
    },
    "InlineTrap": {
      "type": "object",
      "properties": {
        "on": {
          "$ref": "#/definitions/On"
        },
        "when": {
          "$ref": "#/definitions/Condition"
        },
        "every": {
          "type": "number"
        },
        "quiet": {
          "type": "boolean"
        },
        "do": {
          "type": "array",
          "items": {
            "$ref": "#/definitions/Effect"
          }
        }
      },
      "required": [
        "on",
        "do"
      ],
      "additionalProperties": false,
      "description": "A trap authored inline on a variant/template (carries no name/icon of its own)."
    },
    "Template": {
      "type": "object",
      "properties": {
        "name": {
          "type": "string"
        },
        "icon": {
          "type": "string"
        },
        "desc": {
          "type": "string"
        },
        "stat_mod": {
          "$ref": "#/definitions/StatMod"
        },
        "trap": {
          "$ref": "#/definitions/InlineTrap"
        }
      },
      "required": [
        "name",
        "trap"
      ],
      "additionalProperties": false
    },
    "Dungeon": {
      "type": "object",
      "properties": {
        "name": {
          "type": "string"
        },
        "difficulty": {
          "type": "number"
        },
        "coach": {
          "type": "boolean"
        },
        "guided": {
          "type": "boolean"
        },
        "theme": {
          "anyOf": [
            {
              "$ref": "#/definitions/Theme"
            },
            {
              "type": "null"
            }
          ]
        },
        "drift": {
          "type": [
            "string",
            "null"
          ]
        },
        "boss_mirror": {
          "type": [
            "string",
            "null"
          ]
        },
        "default_foe": {
          "type": "string"
        },
        "sequence": {
          "type": "array",
          "items": {
            "type": "string"
          }
        },
        "enemy_table": {
          "type": "array",
          "items": {
            "$ref": "#/definitions/EnemyTableEntry"
          }
        },
        "elite_pool": {
          "type": "array",
          "items": {
            "type": "string"
          }
        },
        "boss": {
          "type": [
            "string",
            "null"
          ]
        },
        "template": {
          "type": [
            "string",
            "null"
          ]
        },
        "extends": {
          "type": "string"
        }
      },
      "required": [
        "name",
        "difficulty",
        "enemy_table",
        "elite_pool"
      ],
      "additionalProperties": false
    },
    "Theme": {
      "type": "object",
      "properties": {
        "axis": {
          "$ref": "#/definitions/Axis"
        },
        "value": {
          "$ref": "#/definitions/ValueTok"
        }
      },
      "required": [
        "axis",
        "value"
      ],
      "additionalProperties": false
    },
    "EnemyTableEntry": {
      "type": "object",
      "properties": {
        "foe": {
          "type": "string"
        },
        "weight": {
          "type": "number"
        }
      },
      "required": [
        "foe",
        "weight"
      ],
      "additionalProperties": false
    },
    "Encounter": {
      "type": "object",
      "properties": {
        "traps": {
          "type": "array",
          "items": {
            "type": "string"
          }
        },
        "drift": {
          "type": "string"
        }
      },
      "required": [
        "traps",
        "drift"
      ],
      "additionalProperties": false
    }
  }
}
